{
  "schema_version": 1,
  "id": "sony-wh-1000xm5",
  "type": "headphone",
  "name": "Sony WH-1000XM5",
  "source": "Bisen-DSP-System headphoneProfiles.ts より移植 (2026-10-12)。Harman 2019 Over-Ear 相当の Bisen 手調整値",
  "purpose": "device_correction",
  "preamp_db": -4.2,
  "target_curve": "custom",
  "notes": "Harman 2019 Over-Ear 相当 (スキーマの target_curve enum に 2019 が無いため custom 表記)。",
  "bands": [
    {"type": "peaking", "freq": 31, "q": 0.7, "gain": -2.5},
    {"type": "peaking", "freq": 62, "q": 1.2, "gain": -1.8},
    {"type": "peaking", "freq": 125, "q": 1.4, "gain": -3.2},
    {"type": "peaking", "freq": 250, "q": 1.0, "gain": 0.5},
    {"type": "peaking", "freq": 1000, "q": 1.6, "gain": 1.8},
    {"type": "peaking", "freq": 2500, "q": 2.0, "gain": 3.5},
    {"type": "peaking", "freq": 5000, "q": 2.5, "gain": -2.0},
    {"type": "peaking", "freq": 8000, "q": 1.8, "gain": 4.0},
    {"type": "peaking", "freq": 12000, "q": 1.0, "gain": -1.5}
  ]
}
