{
  "schema_version": 1,
  "id": "etymotic-er4sr",
  "type": "headphone",
  "name": "Etymotic ER4SR",
  "source": "AutoEq (jaakkopasanen/AutoEq) — Bisen-DSP-System headphoneProfiles.ts より移植 (2026-10-12)",
  "purpose": "device_correction",
  "preamp_db": -6.0,
  "target_curve": "diffuse_field",
  "notes": "AutoEQ Diffuse Field ターゲット。Bisen 内蔵 10 バンド PEQ と同一係数。",
  "bands": [
    {"type": "lowshelf", "freq": 105, "q": 0.70, "gain": 6.0},
    {"type": "peaking", "freq": 2470, "q": 0.94, "gain": -3.7},
    {"type": "peaking", "freq": 7389, "q": 1.15, "gain": 6.4},
    {"type": "peaking", "freq": 77, "q": 2.20, "gain": 1.2},
    {"type": "peaking", "freq": 1450, "q": 2.27, "gain": -1.8},
    {"type": "highshelf", "freq": 10000, "q": 0.70, "gain": 2.5},
    {"type": "peaking", "freq": 269, "q": 1.17, "gain": -0.5},
    {"type": "peaking", "freq": 745, "q": 2.09, "gain": 0.5},
    {"type": "peaking", "freq": 7552, "q": 4.20, "gain": -0.8},
    {"type": "peaking", "freq": 9634, "q": 5.99, "gain": -1.0}
  ]
}
